title,doi,authors,year
Spatially Varying Effects of Street Greenery on Walking Time of Older Adults,https://doi.org/10.3390/ijgi10090596,Yang et al.,2021
"The green view dataset for the capital of Finland, Helsinki",https://doi.org/10.1016/j.dib.2020.105601,Toikka et al.,2020
How to best map greenery from a human perspective? Comparing computational measurements with human perception,https://doi.org/10.3389/frsc.2023.1160995,Torkko et al.,2023
Near Real-Time Semantic View Analysis of 3D City Models in Web Browser,https://doi.org/10.3390/ijgi10030138,Virtanen et al.,2021
"An evaluation of urban green space in Shanghai, China, using eye tracking",https://doi.org/10.1016/j.ufug.2020.126903,Li et al.,2020
"Relationship between eye-level greenness and cycling frequency around metro stations in Shenzhen, China: A big data approach",https://doi.org/10.1016/j.scs.2020.102201,Wang et al. ,2020
The effect of eye-level street greenness exposure on walking satisfaction: The mediating role of noise and PM2.5,https://doi.org/10.1016/j.ufug.2022.127752,Song et al.,2022
Effect Modifications of Overhead-View and Eye-Level Urban Greenery on HeatMortality Associations: Small-Area Analyses Using Case Time Series Design and Different Greenery Measurements,https://doi.org/10.1289/EHP12589,Song et al.,2023
